[2026-02-03 23:19:13] root: INFO: Starting Flye 2.9.6-b1802
[2026-02-03 23:19:13] root: DEBUG: Cmd: /home/matda/miniconda3/envs/flye/bin/flye --nano-raw SRR32410565.fastq.gz --out-dir flye_out --threads 8 --asm-coverage 60 --genome-size 5m
[2026-02-03 23:19:13] root: DEBUG: Python version: 3.12.12 | packaged by conda-forge | (main, Jan 26 2026, 23:51:32) [GCC 14.3.0]
[2026-02-03 23:19:13] root: INFO: >>>STAGE: configure
[2026-02-03 23:19:13] root: INFO: Configuring run
[2026-02-03 23:19:24] root: INFO: Total read length: 809296219
[2026-02-03 23:19:24] root: INFO: Input genome size: 5000000
[2026-02-03 23:19:24] root: INFO: Estimated coverage: 161
[2026-02-03 23:19:24] root: INFO: Reads N50/N90: 4683 / 2687
[2026-02-03 23:19:24] root: INFO: Minimum overlap set to 3000
[2026-02-03 23:19:24] root: INFO: Using longest 60x reads for contig assembly
[2026-02-03 23:19:24] root: DEBUG: Min read length cutoff: 5293
[2026-02-03 23:19:24] root: INFO: >>>STAGE: assembly
[2026-02-03 23:19:24] root: INFO: Assembling disjointigs
[2026-02-03 23:19:24] root: DEBUG: -----Begin assembly log------
[2026-02-03 23:19:24] root: DEBUG: Running: flye-modules assemble --reads /home/matda/Assignment1Data/SRR32410565.fastq.gz --out-asm /home/matda/Assignment1Data/flye_out/00-assembly/draft_assembly.fasta --config /home/matda/miniconda3/envs/flye/lib/python3.12/site-packages/flye/config/bin_cfg/asm_raw_reads.cfg --log /home/matda/Assignment1Data/flye_out/flye.log --threads 8 --genome-size 5000000 --min-ovlp 3000 --min-read 5293
[2026-02-03 23:19:24] DEBUG: Build date: May  4 2025 23:17:52
[2026-02-03 23:19:24] DEBUG: Total RAM: 15 Gb
[2026-02-03 23:19:24] DEBUG: Available RAM: 15 Gb
[2026-02-03 23:19:24] DEBUG: Total CPUs: 16
[2026-02-03 23:19:24] DEBUG: Loading /home/matda/miniconda3/envs/flye/lib/python3.12/site-packages/flye/config/bin_cfg/asm_raw_reads.cfg
[2026-02-03 23:19:24] DEBUG: Loading /home/matda/miniconda3/envs/flye/lib/python3.12/site-packages/flye/config/bin_cfg/asm_defaults.cfg
[2026-02-03 23:19:24] DEBUG: 	big_genome_threshold=29000000
[2026-02-03 23:19:24] DEBUG: 	meta_read_filter_kmer_freq=100
[2026-02-03 23:19:24] DEBUG: 	chain_large_gap_penalty=2
[2026-02-03 23:19:24] DEBUG: 	chain_small_gap_penalty=0.5
[2026-02-03 23:19:24] DEBUG: 	chain_gap_jump_threshold=100
[2026-02-03 23:19:24] DEBUG: 	max_jump_gap=500
[2026-02-03 23:19:24] DEBUG: 	max_coverage_drop_rate=5
[2026-02-03 23:19:24] DEBUG: 	max_extensions_drop_rate=5
[2026-02-03 23:19:24] DEBUG: 	chimera_window=100
[2026-02-03 23:19:24] DEBUG: 	chimera_overhang=1000
[2026-02-03 23:19:24] DEBUG: 	min_reads_in_disjointig=4
[2026-02-03 23:19:24] DEBUG: 	max_inner_reads=10
[2026-02-03 23:19:24] DEBUG: 	max_inner_fraction=0.25
[2026-02-03 23:19:24] DEBUG: 	aggressive_dup_filter=1
[2026-02-03 23:19:24] DEBUG: 	max_separation=500
[2026-02-03 23:19:24] DEBUG: 	unique_edge_length=50000
[2026-02-03 23:19:24] DEBUG: 	min_repeat_res_support=0.51
[2026-02-03 23:19:24] DEBUG: 	out_paths_ratio=5
[2026-02-03 23:19:24] DEBUG: 	graph_cov_drop_rate=5
[2026-02-03 23:19:24] DEBUG: 	coverage_estimate_window=100
[2026-02-03 23:19:24] DEBUG: 	max_bubble_length=50000
[2026-02-03 23:19:24] DEBUG: 	loop_coverage_rate=1.5
[2026-02-03 23:19:24] DEBUG: 	repeat_edge_cov_mult=1.75
[2026-02-03 23:19:24] DEBUG: 	weak_detach_rate=5
[2026-02-03 23:19:24] DEBUG: 	tip_coverage_rate=2
[2026-02-03 23:19:24] DEBUG: 	tip_length_rate=2
[2026-02-03 23:19:24] DEBUG: 	output_gfa_before_rr=1
[2026-02-03 23:19:24] DEBUG: 	remove_alt_edges=0
[2026-02-03 23:19:24] DEBUG: 	low_cutoff_warning=1
[2026-02-03 23:19:24] DEBUG: 	kmer_size=17
[2026-02-03 23:19:24] DEBUG: 	use_minimizers=0
[2026-02-03 23:19:24] DEBUG: 	reads_base_alignment=0
[2026-02-03 23:19:24] DEBUG: 	meta_read_top_kmer_rate=0.40
[2026-02-03 23:19:24] DEBUG: 	maximum_jump=1500
[2026-02-03 23:19:24] DEBUG: 	maximum_overhang=1500
[2026-02-03 23:19:24] DEBUG: 	repeat_kmer_rate=100
[2026-02-03 23:19:24] DEBUG: 	assemble_ovlp_divergence=0.10
[2026-02-03 23:19:24] DEBUG: 	assemble_divergence_relative=1
[2026-02-03 23:19:24] DEBUG: 	repeat_graph_ovlp_divergence=0.08
[2026-02-03 23:19:24] DEBUG: 	read_align_ovlp_divergence=0.25
[2026-02-03 23:19:24] DEBUG: 	hpc_scoring_on=0
[2026-02-03 23:19:24] DEBUG: 	add_unassembled_reads=0
[2026-02-03 23:19:24] DEBUG: 	extend_contigs_with_repeats=0
[2026-02-03 23:19:24] DEBUG: 	min_read_cov_cutoff=3
[2026-02-03 23:19:24] DEBUG: 	short_tip_length=20000
[2026-02-03 23:19:24] DEBUG: 	long_tip_length=100000
[2026-02-03 23:19:24] DEBUG: Running with k-mer size: 17
[2026-02-03 23:19:24] DEBUG: Running with minimum overlap 3000
[2026-02-03 23:19:24] DEBUG: Metagenome mode: N
[2026-02-03 23:19:24] DEBUG: Short mode: N
[2026-02-03 23:19:24] INFO: Reading sequences
[2026-02-03 23:19:32] DEBUG: Building positional index
[2026-02-03 23:19:32] DEBUG: Total sequence: 299976032 bp
[2026-02-03 23:19:38] INFO: Counting k-mers:
[2026-02-03 23:19:56] DEBUG: Updating k-mer histogram
[2026-02-03 23:20:42] DEBUG: Hash size: 4981920
[2026-02-03 23:20:42] DEBUG: Total k-mers 38549696
[2026-02-03 23:20:42] INFO: Filling index table (1/2)
[2026-02-03 23:21:11] DEBUG: Mean k-mer frequency: 32.2387
[2026-02-03 23:21:11] DEBUG: Repetitive k-mer frequency: 3223
[2026-02-03 23:21:11] DEBUG: Filtered 59794 repetitive k-mers (0.000473621)
[2026-02-03 23:21:11] INFO: Filling index table (2/2)
[2026-02-03 23:21:41] DEBUG: Sorting k-mer index
[2026-02-03 23:21:41] DEBUG: Selected k-mers: 4677321
[2026-02-03 23:21:41] DEBUG: Index size: 126940249
[2026-02-03 23:21:41] DEBUG: Mean k-mer index frequency: 27.1395
[2026-02-03 23:21:41] DEBUG: Peak RAM usage: 9 Gb
[2026-02-03 23:21:41] DEBUG: Estimating k-mer identity bias
[2026-02-03 23:21:46] DEBUG: Initial divergence estimate : 0.0535719
[2026-02-03 23:21:46] DEBUG: Relative threshold: Y
[2026-02-03 23:21:46] DEBUG: Max divergence threshold set to 0.153572
[2026-02-03 23:21:46] INFO: Extending reads
[2026-02-03 23:21:46] DEBUG: Estimating overlap coverage
[2026-02-03 23:22:20] INFO: Overlap-based coverage: 55
[2026-02-03 23:22:20] INFO: Median overlap divergence: 0.0538249
[2026-02-03 23:22:20] DEBUG: Sequence divergence distribution: 

    |          *                   |                                                                     
    |          *                   |                                                                     
    |          *                   |                                                                     
    |          *                   |                                                                     
    |          *                   |                                                                     
    |         **                   |                                                                     
    |         ***                  |                                                                     
    |         ***                  |                                                                     
    |         ***                  |                                                                     
    |        ****                  |                                                                     
    |        ****                  |                                                                     
    |        ****                  |                                                                     
    |        *****                 |                                                                     
    |       ******                 |                                                                     
    |       ******                 |                                                                     
    |       *******                |                                                                     
    |      *********               |                                                                     
    |      ***********             |                                                                     
    |     ***************  * *     |                                                                     
    |    **************************|** *    *          *                                                 
    ----------------------------------------------------------------------------------------------------
    0%        5%        10%       15%       20%       25%       30%       35%       40%       45%       

    Q25 = 0.047, Q50 = 0.054, Q75 = 0.064

[2026-02-03 23:22:23] DEBUG: Assembled disjointig 1
	With 82 reads
	Start read: +SRR32410565.84468
	At position: 78
	leftTip: 0 rightTip: 0
	Suspicious: 2
	Short ext: 2
	Mean extensions: 40
	Avg overlap len: 5719
	Min overlap len: 2374
	Inner reads: 0
	Length: 172743
[2026-02-03 23:22:23] DEBUG: Inner: 3468 covered: 4204 total: 93344
[2026-02-03 23:22:23] DEBUG: Discarded disjointig with 84 reads and 41 inner overlaps
[2026-02-03 23:22:30] DEBUG: Assembled disjointig 2
	With 537 reads
	Start read: +SRR32410565.190670
	At position: 198
	leftTip: 0 rightTip: 0
	Suspicious: 34
	Short ext: 10
	Mean extensions: 33
	Avg overlap len: 5562
	Min overlap len: 1491
	Inner reads: 0
	Length: 1162387
[2026-02-03 23:22:30] DEBUG: Inner: 24402 covered: 26584 total: 93344
[2026-02-03 23:22:30] DEBUG: Discarded disjointig with 537 reads and 531 inner overlaps
[2026-02-03 23:22:30] DEBUG: Discarded disjointig with 584 reads and 573 inner overlaps
[2026-02-03 23:22:30] DEBUG: Discarded disjointig with 293 reads and 280 inner overlaps
[2026-02-03 23:22:30] DEBUG: Discarded disjointig with 433 reads and 430 inner overlaps
[2026-02-03 23:22:30] DEBUG: Discarded disjointig with 400 reads and 170 inner overlaps
[2026-02-03 23:22:32] DEBUG: Assembled disjointig 3
	With 237 reads
	Start read: +SRR32410565.144058
	At position: 145
	leftTip: 0 rightTip: 1
	Suspicious: 11
	Short ext: 1
	Mean extensions: 25
	Avg overlap len: 5472
	Min overlap len: 2313
	Inner reads: 0
	Length: 494901
[2026-02-03 23:22:32] DEBUG: Inner: 31106 covered: 33648 total: 93344
[2026-02-03 23:22:32] DEBUG: Discarded disjointig with 235 reads and 231 inner overlaps
[2026-02-03 23:22:33] DEBUG: Assembled disjointig 4
	With 65 reads
	Start read: +SRR32410565.12092
	At position: 51
	leftTip: 0 rightTip: 1
	Suspicious: 8
	Short ext: 2
	Mean extensions: 27
	Avg overlap len: 5456
	Min overlap len: 1469
	Inner reads: 0
	Length: 139849
[2026-02-03 23:22:33] DEBUG: Inner: 32972 covered: 35640 total: 93344
[2026-02-03 23:22:35] DEBUG: Assembled disjointig 5
	With 330 reads
	Start read: +SRR32410565.155475
	At position: 102
	leftTip: 1 rightTip: 0
	Suspicious: 15
	Short ext: 7
	Mean extensions: 34
	Avg overlap len: 5599
	Min overlap len: 1395
	Inner reads: 0
	Length: 711736
[2026-02-03 23:22:35] DEBUG: Inner: 45790 covered: 49084 total: 93344
[2026-02-03 23:22:35] DEBUG: Discarded disjointig with 254 reads and 251 inner overlaps
[2026-02-03 23:22:35] DEBUG: Discarded disjointig with 113 reads and 111 inner overlaps
[2026-02-03 23:22:37] DEBUG: Assembled disjointig 6
	With 42 reads
	Start read: +SRR32410565.57367
	At position: 31
	leftTip: 0 rightTip: 0
	Suspicious: 6
	Short ext: 2
	Mean extensions: 36
	Avg overlap len: 5659
	Min overlap len: 2412
	Inner reads: 0
	Length: 102298
[2026-02-03 23:22:37] DEBUG: Inner: 47710 covered: 51094 total: 93344
[2026-02-03 23:22:40] DEBUG: Assembled disjointig 7
	With 211 reads
	Start read: +SRR32410565.155392
	At position: 159
	leftTip: 0 rightTip: 0
	Suspicious: 7
	Short ext: 3
	Mean extensions: 39
	Avg overlap len: 5702
	Min overlap len: 2530
	Inner reads: 0
	Length: 452609
[2026-02-03 23:22:40] DEBUG: Inner: 57290 covered: 60934 total: 93344
[2026-02-03 23:22:40] DEBUG: Discarded disjointig with 131 reads and 125 inner overlaps
[2026-02-03 23:22:40] DEBUG: Discarded disjointig with 76 reads and 72 inner overlaps
[2026-02-03 23:22:40] DEBUG: Discarded disjointig with 44 reads and 42 inner overlaps
[2026-02-03 23:22:40] DEBUG: Discarded disjointig with 278 reads and 212 inner overlaps
[2026-02-03 23:22:45] DEBUG: Assembled disjointig 8
	With 240 reads
	Start read: +SRR32410565.145338
	At position: 83
	leftTip: 1 rightTip: 0
	Suspicious: 7
	Short ext: 3
	Mean extensions: 30
	Avg overlap len: 5458
	Min overlap len: 2616
	Inner reads: 0
	Length: 519441
[2026-02-03 23:22:45] DEBUG: Inner: 65574 covered: 69616 total: 93344
[2026-02-03 23:22:45] DEBUG: Discarded disjointig with 218 reads and 216 inner overlaps
[2026-02-03 23:22:45] DEBUG: Discarded disjointig with 223 reads and 221 inner overlaps
[2026-02-03 23:22:45] DEBUG: Assembled disjointig 9
	With 254 reads
	Start read: +SRR32410565.32141
	At position: 195
	leftTip: 0 rightTip: 0
	Suspicious: 9
	Short ext: 3
	Mean extensions: 29
	Avg overlap len: 5589
	Min overlap len: 1680
	Inner reads: 0
	Length: 569235
[2026-02-03 23:22:45] DEBUG: Inner: 74212 covered: 78652 total: 93344
[2026-02-03 23:22:45] DEBUG: Discarded disjointig with 296 reads and 289 inner overlaps
[2026-02-03 23:22:45] DEBUG: Discarded disjointig with 132 reads and 129 inner overlaps
[2026-02-03 23:22:45] DEBUG: Assembled disjointig 10
	With 65 reads
	Start read: +SRR32410565.78337
	At position: 39
	leftTip: 0 rightTip: 0
	Suspicious: 2
	Short ext: 0
	Mean extensions: 41
	Avg overlap len: 5644
	Min overlap len: 3254
	Inner reads: 0
	Length: 134508
[2026-02-03 23:22:45] DEBUG: Inner: 76454 covered: 80930 total: 93344
[2026-02-03 23:22:46] DEBUG: Assembled disjointig 11
	With 141 reads
	Start read: +SRR32410565.107283
	At position: 67
	leftTip: 0 rightTip: 0
	Suspicious: 8
	Short ext: 0
	Mean extensions: 27
	Avg overlap len: 5344
	Min overlap len: 3110
	Inner reads: 0
	Length: 313817
[2026-02-03 23:22:46] DEBUG: Inner: 80444 covered: 85136 total: 93344
[2026-02-03 23:22:46] DEBUG: Discarded disjointig with 266 reads and 263 inner overlaps
[2026-02-03 23:22:46] DEBUG: Discarded disjointig with 75 reads and 73 inner overlaps
[2026-02-03 23:22:46] DEBUG: Discarded disjointig with 343 reads and 257 inner overlaps
[2026-02-03 23:22:46] DEBUG: Discarded disjointig with 222 reads and 133 inner overlaps
[2026-02-03 23:22:46] DEBUG: Discarded disjointig with 220 reads and 133 inner overlaps
[2026-02-03 23:22:46] DEBUG: Assembled disjointig 12
	With 85 reads
	Start read: +SRR32410565.22410
	At position: 74
	leftTip: 1 rightTip: 0
	Suspicious: 1
	Short ext: 1
	Mean extensions: 27
	Avg overlap len: 5414
	Min overlap len: 3015
	Inner reads: 0
	Length: 182790
[2026-02-03 23:22:46] DEBUG: Inner: 82920 covered: 87702 total: 93344
[2026-02-03 23:22:46] DEBUG: Discarded disjointig with 43 reads and 39 inner overlaps
[2026-02-03 23:22:48] DEBUG: Assembled disjointig 13
	With 56 reads
	Start read: +SRR32410565.122752
	At position: 51
	leftTip: 1 rightTip: 0
	Suspicious: 2
	Short ext: 0
	Mean extensions: 46
	Avg overlap len: 5717
	Min overlap len: 3905
	Inner reads: 0
	Length: 119961
[2026-02-03 23:22:48] DEBUG: Inner: 85420 covered: 90558 total: 93344
[2026-02-03 23:22:48] DEBUG: Discarded disjointig with 42 reads and 39 inner overlaps
[2026-02-03 23:22:48] DEBUG: Assembled disjointig 14
	With 21 reads
	Start read: +SRR32410565.2059
	At position: 16
	leftTip: 0 rightTip: 0
	Suspicious: 4
	Short ext: 2
	Mean extensions: 25
	Avg overlap len: 5048
	Min overlap len: 2783
	Inner reads: 0
	Length: 61294
[2026-02-03 23:22:48] DEBUG: Inner: 85956 covered: 91186 total: 93344
[2026-02-03 23:22:48] DEBUG: Discarded disjointig with 33 reads and 17 inner overlaps
[2026-02-03 23:22:48] DEBUG: Discarded disjointig with 38 reads and 35 inner overlaps
[2026-02-03 23:22:48] DEBUG: Discarded disjointig with 54 reads and 52 inner overlaps
[2026-02-03 23:22:48] DEBUG: Discarded disjointig with 45 reads and 42 inner overlaps
[2026-02-03 23:22:48] DEBUG: Discarded disjointig with 52 reads and 47 inner overlaps
[2026-02-03 23:22:48] DEBUG: Discarded disjointig with 3 reads and 1 inner overlaps
[2026-02-03 23:22:48] DEBUG: Assembled disjointig 15
	With 16 reads
	Start read: +SRR32410565.190782
	At position: 10
	leftTip: 0 rightTip: 0
	Suspicious: 2
	Short ext: 0
	Mean extensions: 24
	Avg overlap len: 5329
	Min overlap len: 3413
	Inner reads: 0
	Length: 38883
[2026-02-03 23:22:48] DEBUG: Inner: 86362 covered: 91678 total: 93344
[2026-02-03 23:22:48] DEBUG: Discarded disjointig with 16 reads and 13 inner overlaps
[2026-02-03 23:22:48] DEBUG: Discarded disjointig with 15 reads and 11 inner overlaps
[2026-02-03 23:22:49] DEBUG: Assembled disjointig 16
	With 10 reads
	Start read: +SRR32410565.9180
	At position: 3
	leftTip: 0 rightTip: 0
	Suspicious: 2
	Short ext: 0
	Mean extensions: 34
	Avg overlap len: 4771
	Min overlap len: 3171
	Inner reads: 0
	Length: 26585
[2026-02-03 23:22:49] DEBUG: Inner: 86594 covered: 91942 total: 93344
[2026-02-03 23:22:49] DEBUG: Discarded disjointig with 5 reads and 3 inner overlaps
[2026-02-03 23:22:49] DEBUG: Discarded disjointig with 4 reads and 2 inner overlaps
[2026-02-03 23:22:49] DEBUG: Assembled disjointig 17
	With 15 reads
	Start read: +SRR32410565.40286
	At position: 10
	leftTip: 0 rightTip: 0
	Suspicious: 1
	Short ext: 1
	Mean extensions: 33
	Avg overlap len: 4996
	Min overlap len: 2021
	Inner reads: 0
	Length: 38113
[2026-02-03 23:22:49] DEBUG: Inner: 86904 covered: 92288 total: 93344
[2026-02-03 23:22:49] DEBUG: Discarded disjointig with 16 reads and 14 inner overlaps
[2026-02-03 23:22:49] DEBUG: Discarded disjointig with 16 reads and 14 inner overlaps
[2026-02-03 23:22:49] DEBUG: Discarded disjointig with 10 reads and 8 inner overlaps
[2026-02-03 23:22:50] DEBUG: Assembled disjointig 18
	With 3 reads
	Start read: +SRR32410565.164857
	At position: 2
	leftTip: 0 rightTip: 0
	Suspicious: 0
	Short ext: 0
	Mean extensions: 227
	Avg overlap len: 5409
	Min overlap len: 4105
	Inner reads: 0
	Length: 10271
[2026-02-03 23:22:50] DEBUG: Inner: 86906 covered: 92326 total: 93344
[2026-02-03 23:22:50] DEBUG: Assembled disjointig 19
	With 4 reads
	Start read: +SRR32410565.158140
	At position: 2
	leftTip: 0 rightTip: 0
	Suspicious: 0
	Short ext: 0
	Mean extensions: 46
	Avg overlap len: 4827
	Min overlap len: 3892
	Inner reads: 0
	Length: 15514
[2026-02-03 23:22:50] DEBUG: Inner: 86910 covered: 92354 total: 93344
[2026-02-03 23:22:53] DEBUG: Assembled disjointig 20
	With 4 reads
	Start read: +SRR32410565.64187
	At position: 3
	leftTip: 0 rightTip: 0
	Suspicious: 2
	Short ext: 1
	Mean extensions: 13
	Avg overlap len: 3795
	Min overlap len: 1720
	Inner reads: 0
	Length: 13161
[2026-02-03 23:22:53] DEBUG: Inner: 86914 covered: 92486 total: 93344
[2026-02-03 23:22:54] DEBUG: Assembled disjointig 21
	With 4 reads
	Start read: +SRR32410565.152774
	At position: 2
	leftTip: 0 rightTip: 0
	Suspicious: 0
	Short ext: 0
	Mean extensions: 34
	Avg overlap len: 4483
	Min overlap len: 3770
	Inner reads: 0
	Length: 15393
[2026-02-03 23:22:54] DEBUG: Inner: 86918 covered: 92604 total: 93344
[2026-02-03 23:22:56] DEBUG: Assembled disjointig 22
	With 3 reads
	Start read: +SRR32410565.188500
	At position: 2
	leftTip: 0 rightTip: 0
	Suspicious: 0
	Short ext: 0
	Mean extensions: 258
	Avg overlap len: 5787
	Min overlap len: 4245
	Inner reads: 0
	Length: 9852
[2026-02-03 23:22:56] DEBUG: Inner: 86920 covered: 92698 total: 93344
[2026-02-03 23:22:58] DEBUG: Assembled disjointig 23
	With 3 reads
	Start read: +SRR32410565.189987
	At position: 2
	leftTip: 0 rightTip: 0
	Suspicious: 0
	Short ext: 0
	Mean extensions: 261
	Avg overlap len: 4762
	Min overlap len: 4485
	Inner reads: 0
	Length: 10400
[2026-02-03 23:22:58] DEBUG: Inner: 86922 covered: 92790 total: 93344
[2026-02-03 23:22:58] DEBUG: Assembled disjointig 24
	With 3 reads
	Start read: +SRR32410565.64664
	At position: 2
	leftTip: 0 rightTip: 0
	Suspicious: 0
	Short ext: 0
	Mean extensions: 250
	Avg overlap len: 5754
	Min overlap len: 4860
	Inner reads: 0
	Length: 9918
[2026-02-03 23:22:58] DEBUG: Inner: 86924 covered: 92816 total: 93344
[2026-02-03 23:22:59] DEBUG: Assembled disjointig 25
	With 3 reads
	Start read: +SRR32410565.6618
	At position: 2
	leftTip: 0 rightTip: 0
	Suspicious: 0
	Short ext: 0
	Mean extensions: 255
	Avg overlap len: 5526
	Min overlap len: 4082
	Inner reads: 0
	Length: 9789
[2026-02-03 23:22:59] DEBUG: Inner: 86926 covered: 92858 total: 93344
[2026-02-03 23:23:00] DEBUG: Assembled disjointig 26
	With 3 reads
	Start read: +SRR32410565.134393
	At position: 2
	leftTip: 0 rightTip: 0
	Suspicious: 0
	Short ext: 0
	Mean extensions: 250
	Avg overlap len: 5770
	Min overlap len: 4882
	Inner reads: 0
	Length: 9919
[2026-02-03 23:23:00] DEBUG: Inner: 86928 covered: 92932 total: 93344
[2026-02-03 23:23:01] DEBUG: Assembled disjointig 27
	With 3 reads
	Start read: +SRR32410565.183679
	At position: 2
	leftTip: 0 rightTip: 0
	Suspicious: 0
	Short ext: 0
	Mean extensions: 261
	Avg overlap len: 4626
	Min overlap len: 4278
	Inner reads: 0
	Length: 9322
[2026-02-03 23:23:01] DEBUG: Inner: 86930 covered: 92970 total: 93344
[2026-02-03 23:23:02] DEBUG: Assembled disjointig 28
	With 3 reads
	Start read: +SRR32410565.165807
	At position: 2
	leftTip: 0 rightTip: 0
	Suspicious: 0
	Short ext: 0
	Mean extensions: 234
	Avg overlap len: 5771
	Min overlap len: 4216
	Inner reads: 0
	Length: 9890
[2026-02-03 23:23:02] DEBUG: Inner: 86932 covered: 92992 total: 93344
[2026-02-03 23:23:02] DEBUG: Assembled disjointig 29
	With 3 reads
	Start read: +SRR32410565.58101
	At position: 2
	leftTip: 0 rightTip: 0
	Suspicious: 0
	Short ext: 0
	Mean extensions: 252
	Avg overlap len: 5750
	Min overlap len: 4835
	Inner reads: 0
	Length: 9897
[2026-02-03 23:23:02] DEBUG: Inner: 86934 covered: 92998 total: 93344
[2026-02-03 23:23:04] DEBUG: Assembled disjointig 30
	With 3 reads
	Start read: +SRR32410565.16614
	At position: 2
	leftTip: 0 rightTip: 0
	Suspicious: 0
	Short ext: 0
	Mean extensions: 236
	Avg overlap len: 5378
	Min overlap len: 3801
	Inner reads: 0
	Length: 9903
[2026-02-03 23:23:04] DEBUG: Inner: 86936 covered: 93068 total: 93344
[2026-02-03 23:23:04] DEBUG: Assembled disjointig 31
	With 3 reads
	Start read: +SRR32410565.84860
	At position: 2
	leftTip: 0 rightTip: 0
	Suspicious: 0
	Short ext: 0
	Mean extensions: 230
	Avg overlap len: 5281
	Min overlap len: 3833
	Inner reads: 0
	Length: 9894
[2026-02-03 23:23:04] DEBUG: Inner: 86938 covered: 93100 total: 93344
[2026-02-03 23:23:05] DEBUG: Assembled disjointig 32
	With 3 reads
	Start read: +SRR32410565.164833
	At position: 2
	leftTip: 0 rightTip: 0
	Suspicious: 0
	Short ext: 0
	Mean extensions: 227
	Avg overlap len: 5088
	Min overlap len: 4130
	Inner reads: 0
	Length: 10271
[2026-02-03 23:23:05] DEBUG: Inner: 86940 covered: 93116 total: 93344
[2026-02-03 23:23:05] DEBUG: Assembled disjointig 33
	With 3 reads
	Start read: +SRR32410565.53080
	At position: 2
	leftTip: 0 rightTip: 0
	Suspicious: 0
	Short ext: 0
	Mean extensions: 256
	Avg overlap len: 5739
	Min overlap len: 4223
	Inner reads: 0
	Length: 9890
[2026-02-03 23:23:05] DEBUG: Inner: 86942 covered: 93122 total: 93344
[2026-02-03 23:23:07] DEBUG: Assembled disjointig 34
	With 4 reads
	Start read: +SRR32410565.135204
	At position: 3
	leftTip: 0 rightTip: 0
	Suspicious: 0
	Short ext: 0
	Mean extensions: 40
	Avg overlap len: 4617
	Min overlap len: 3832
	Inner reads: 0
	Length: 14743
[2026-02-03 23:23:07] DEBUG: Inner: 86948 covered: 93276 total: 93344
[2026-02-03 23:23:08] INFO: Assembled 34 disjointigs
[2026-02-03 23:23:08] INFO: Generating sequence
[2026-02-03 23:23:08] DEBUG: Building positional index
[2026-02-03 23:23:08] DEBUG: Total sequence: 5427609 bp
[2026-02-03 23:23:09] DEBUG: Mean k-mer frequency: 1.07254
[2026-02-03 23:23:09] DEBUG: Repetitive k-mer frequency: 107
[2026-02-03 23:23:09] DEBUG: Filtered 0 repetitive k-mers (0)
[2026-02-03 23:23:09] DEBUG: Sorting k-mer index
[2026-02-03 23:23:09] DEBUG: Selected k-mers: 5059964
[2026-02-03 23:23:09] DEBUG: K-mer index size: 5427031
[2026-02-03 23:23:09] DEBUG: Mean k-mer frequency: 1.07254
[2026-02-03 23:23:09] DEBUG: Minimizer rate: 1.00011
[2026-02-03 23:23:09] INFO: Filtering contained disjointigs
[2026-02-03 23:23:10] DEBUG: Computing transitive closure for overlaps
[2026-02-03 23:23:10] DEBUG: Found 1572 overlaps
[2026-02-03 23:23:10] DEBUG: Left 636 overlaps after filtering
[2026-02-03 23:23:10] INFO: Contained seqs: 17
[2026-02-03 23:23:10] DEBUG: Writing FASTA
[2026-02-03 23:23:10] DEBUG: Peak RAM usage: 9 Gb
-----------End assembly log------------
[2026-02-03 23:23:10] root: DEBUG: Disjointigs length: 5240420, N50: 519381
[2026-02-03 23:23:10] root: INFO: >>>STAGE: consensus
[2026-02-03 23:23:10] root: INFO: Running Minimap2
[2026-02-03 23:24:10] root: INFO: Computing consensus
[2026-02-03 23:25:35] root: INFO: Alignment error rate: 0.036714
[2026-02-03 23:25:35] root: INFO: >>>STAGE: repeat
[2026-02-03 23:25:35] root: INFO: Building and resolving repeat graph
[2026-02-03 23:25:35] root: DEBUG: -----Begin repeat analyser log------
[2026-02-03 23:25:35] root: DEBUG: Running: flye-modules repeat --disjointigs /home/matda/Assignment1Data/flye_out/10-consensus/consensus.fasta --reads /home/matda/Assignment1Data/SRR32410565.fastq.gz --out-dir /home/matda/Assignment1Data/flye_out/20-repeat --config /home/matda/miniconda3/envs/flye/lib/python3.12/site-packages/flye/config/bin_cfg/asm_raw_reads.cfg --log /home/matda/Assignment1Data/flye_out/flye.log --threads 8 --min-ovlp 3000
[2026-02-03 23:25:35] DEBUG: Build date: May  4 2025 23:18:08
[2026-02-03 23:25:35] DEBUG: Total RAM: 15 Gb
[2026-02-03 23:25:35] DEBUG: Available RAM: 15 Gb
[2026-02-03 23:25:35] DEBUG: Total CPUs: 16
[2026-02-03 23:25:35] DEBUG: Loading /home/matda/miniconda3/envs/flye/lib/python3.12/site-packages/flye/config/bin_cfg/asm_raw_reads.cfg
[2026-02-03 23:25:35] DEBUG: Loading /home/matda/miniconda3/envs/flye/lib/python3.12/site-packages/flye/config/bin_cfg/asm_defaults.cfg
[2026-02-03 23:25:35] DEBUG: 	big_genome_threshold=29000000
[2026-02-03 23:25:35] DEBUG: 	meta_read_filter_kmer_freq=100
[2026-02-03 23:25:35] DEBUG: 	chain_large_gap_penalty=2
[2026-02-03 23:25:35] DEBUG: 	chain_small_gap_penalty=0.5
[2026-02-03 23:25:35] DEBUG: 	chain_gap_jump_threshold=100
[2026-02-03 23:25:35] DEBUG: 	max_jump_gap=500
[2026-02-03 23:25:35] DEBUG: 	max_coverage_drop_rate=5
[2026-02-03 23:25:35] DEBUG: 	max_extensions_drop_rate=5
[2026-02-03 23:25:35] DEBUG: 	chimera_window=100
[2026-02-03 23:25:35] DEBUG: 	chimera_overhang=1000
[2026-02-03 23:25:35] DEBUG: 	min_reads_in_disjointig=4
[2026-02-03 23:25:35] DEBUG: 	max_inner_reads=10
[2026-02-03 23:25:35] DEBUG: 	max_inner_fraction=0.25
[2026-02-03 23:25:35] DEBUG: 	aggressive_dup_filter=1
[2026-02-03 23:25:35] DEBUG: 	max_separation=500
[2026-02-03 23:25:35] DEBUG: 	unique_edge_length=50000
[2026-02-03 23:25:35] DEBUG: 	min_repeat_res_support=0.51
[2026-02-03 23:25:35] DEBUG: 	out_paths_ratio=5
[2026-02-03 23:25:35] DEBUG: 	graph_cov_drop_rate=5
[2026-02-03 23:25:35] DEBUG: 	coverage_estimate_window=100
[2026-02-03 23:25:35] DEBUG: 	max_bubble_length=50000
[2026-02-03 23:25:35] DEBUG: 	loop_coverage_rate=1.5
[2026-02-03 23:25:35] DEBUG: 	repeat_edge_cov_mult=1.75
[2026-02-03 23:25:35] DEBUG: 	weak_detach_rate=5
[2026-02-03 23:25:35] DEBUG: 	tip_coverage_rate=2
[2026-02-03 23:25:35] DEBUG: 	tip_length_rate=2
[2026-02-03 23:25:35] DEBUG: 	output_gfa_before_rr=1
[2026-02-03 23:25:35] DEBUG: 	remove_alt_edges=0
[2026-02-03 23:25:35] DEBUG: 	low_cutoff_warning=1
[2026-02-03 23:25:35] DEBUG: 	kmer_size=17
[2026-02-03 23:25:35] DEBUG: 	use_minimizers=0
[2026-02-03 23:25:35] DEBUG: 	reads_base_alignment=0
[2026-02-03 23:25:35] DEBUG: 	meta_read_top_kmer_rate=0.40
[2026-02-03 23:25:35] DEBUG: 	maximum_jump=1500
[2026-02-03 23:25:35] DEBUG: 	maximum_overhang=1500
[2026-02-03 23:25:35] DEBUG: 	repeat_kmer_rate=100
[2026-02-03 23:25:35] DEBUG: 	assemble_ovlp_divergence=0.10
[2026-02-03 23:25:35] DEBUG: 	assemble_divergence_relative=1
[2026-02-03 23:25:35] DEBUG: 	repeat_graph_ovlp_divergence=0.08
[2026-02-03 23:25:35] DEBUG: 	read_align_ovlp_divergence=0.25
[2026-02-03 23:25:35] DEBUG: 	hpc_scoring_on=0
[2026-02-03 23:25:35] DEBUG: 	add_unassembled_reads=0
[2026-02-03 23:25:35] DEBUG: 	extend_contigs_with_repeats=0
[2026-02-03 23:25:35] DEBUG: 	min_read_cov_cutoff=3
[2026-02-03 23:25:35] DEBUG: 	short_tip_length=20000
[2026-02-03 23:25:35] DEBUG: 	long_tip_length=100000
[2026-02-03 23:25:35] DEBUG: Running with k-mer size: 17
[2026-02-03 23:25:35] DEBUG: Selected minimum overlap 3000
[2026-02-03 23:25:35] DEBUG: Metagenome mode: N
[2026-02-03 23:25:35] INFO: Parsing disjointigs
[2026-02-03 23:25:35] DEBUG: Building positional index
[2026-02-03 23:25:35] DEBUG: Total sequence: 5240205 bp
[2026-02-03 23:25:35] INFO: Building repeat graph
[2026-02-03 23:25:36] DEBUG: Mean k-mer frequency: 1.04861
[2026-02-03 23:25:36] DEBUG: Repetitive k-mer frequency: 104
[2026-02-03 23:25:36] DEBUG: Filtered 0 repetitive k-mers (0)
[2026-02-03 23:25:37] DEBUG: Sorting k-mer index
[2026-02-03 23:25:37] DEBUG: Selected k-mers: 4997016
[2026-02-03 23:25:37] DEBUG: K-mer index size: 5239916
[2026-02-03 23:25:37] DEBUG: Mean k-mer frequency: 1.04861
[2026-02-03 23:25:37] DEBUG: Minimizer rate: 1.00006
[2026-02-03 23:25:38] DEBUG: Computing transitive closure for overlaps
[2026-02-03 23:25:38] DEBUG: Found 684 overlaps
[2026-02-03 23:25:38] DEBUG: Left 280 overlaps after filtering
[2026-02-03 23:25:38] INFO: Median overlap divergence: 0.0368429
[2026-02-03 23:25:38] DEBUG: Sequence divergence distribution: 

    |*               |                                                                                   
    |*               |                                                                                   
    |*               |                                                                                   
    |*               |                                                                                   
    |*               |                                                                                   
    |*               |                                                                                   
    |*               |                                                                                   
    |*               |                                                                                   
    |*               |                                                                                   
    |*               |                                                                                   
    |*               |                                                                                   
    |*               |                                                                                   
    |*               |                                                                                   
    |*               |                                                                                   
    |*               |                                                                                   
    |*               |  *                                                                                
    |*    *  *     * |  *          *                                                                     
    |*    *  *     **|  *          *           *   *     *                                               
    |*  * * **     **|  **         *           *   *     *                                               
    |*  * * **     **|  **         *           *   *     *                                               
    ----------------------------------------------------------------------------------------------------
    0%        5%        10%       15%       20%       25%       30%       35%       40%       45%       

    Q25 = 0.0013, Q50 = 0.037, Q75 = 0.098

[2026-02-03 23:25:38] DEBUG: Computing gluepoints
[2026-02-03 23:25:38] DEBUG: Added 2 gluepoint projections
[2026-02-03 23:25:38] DEBUG: Added 0 gluepoint projections
[2026-02-03 23:25:38] DEBUG: Created 316 gluepoints
[2026-02-03 23:25:38] DEBUG: Artificial loops removed: 25 left, 25 right, 0 both
[2026-02-03 23:25:38] DEBUG: Initializing edges
[2026-02-03 23:25:38] DEBUG: Edges length checksum: 10768785269
[2026-02-03 23:25:38] DEBUG: Filtered 0 singleton segments
[2026-02-03 23:25:38] DEBUG: Removed 0 simple and 2 double chimeric junctions
[2026-02-03 23:25:38] DEBUG: Collapsed 21 edges
[2026-02-03 23:25:38] DEBUG: *	54	+disjointig_1	18084	137787	119703	
[2026-02-03 23:25:38] DEBUG:  	55	+disjointig_1	137787	142154	4367	
[2026-02-03 23:25:38] DEBUG: *	53	+disjointig_1	142154	172277	30123	
[2026-02-03 23:25:38] DEBUG:  	55	+disjointig_10	4534	10199	5665	
[2026-02-03 23:25:38] DEBUG: *	-6	+disjointig_10	10199	48072	37873	
[2026-02-03 23:25:38] DEBUG:  	55	+disjointig_10	48072	53921	5849	
[2026-02-03 23:25:38] DEBUG: *	60	+disjointig_10	53921	128717	74796	
[2026-02-03 23:25:38] DEBUG: *	27	+disjointig_11	6289	9141	2852	
[2026-02-03 23:25:38] DEBUG: *	-28	+disjointig_11	26357	28656	2299	
[2026-02-03 23:25:38] DEBUG: *	-64	+disjointig_11	28656	309080	280424	
[2026-02-03 23:25:38] DEBUG: *	-65	+disjointig_12	0	183242	183242	
[2026-02-03 23:25:38] DEBUG: *	66	+disjointig_13	11127	120186	109059	
[2026-02-03 23:25:38] DEBUG: *	36	+disjointig_14	0	10409	10409	
[2026-02-03 23:25:38] DEBUG: *	38	+disjointig_14	20401	53775	33374	
[2026-02-03 23:25:38] DEBUG:  	-55	+disjointig_15	2059	7785	5726	
[2026-02-03 23:25:38] DEBUG: *	57	+disjointig_15	7785	39096	31311	
[2026-02-03 23:25:38] DEBUG: *	-63	+disjointig_16	1	26664	26663	
[2026-02-03 23:25:38] DEBUG:  	55	+disjointig_17	5663	11233	5570	
[2026-02-03 23:25:38] DEBUG: *	16	+disjointig_17	11233	32338	21105	
[2026-02-03 23:25:38] DEBUG:  	-55	+disjointig_2	167	5824	5657	
[2026-02-03 23:25:38] DEBUG: *	9	+disjointig_2	5824	227965	222141	
[2026-02-03 23:25:38] DEBUG:  	45	+disjointig_2	227965	231148	3183	
[2026-02-03 23:25:38] DEBUG: *	47	+disjointig_2	231148	786045	554897	
[2026-02-03 23:25:38] DEBUG: *	-62	+disjointig_2	786045	798523	12478	
[2026-02-03 23:25:38] DEBUG: *	24	+disjointig_2	798523	1067850	269327	
[2026-02-03 23:25:38] DEBUG: *	-58	+disjointig_2	1067850	1155278	87428	
[2026-02-03 23:25:38] DEBUG:  	55	+disjointig_2	1155278	1160311	5033	
[2026-02-03 23:25:38] DEBUG: *	50	+disjointig_3	5332	495694	490362	
[2026-02-03 23:25:38] DEBUG: *	52	+disjointig_4	0	135631	135631	
[2026-02-03 23:25:38] DEBUG: *	-40	+disjointig_5	0	6758	6758	
[2026-02-03 23:25:38] DEBUG: *	67	+disjointig_5	6758	660287	653529	
[2026-02-03 23:25:38] DEBUG:  	-45	+disjointig_5	660287	663633	3346	
[2026-02-03 23:25:38] DEBUG: *	-61	+disjointig_5	663633	708587	44954	
[2026-02-03 23:25:38] DEBUG:  	-55	+disjointig_5	708587	713487	4900	
[2026-02-03 23:25:38] DEBUG: *	59	+disjointig_6	2710	93387	90677	
[2026-02-03 23:25:38] DEBUG:  	-55	+disjointig_6	93387	98627	5240	
[2026-02-03 23:25:38] DEBUG: *	-56	+disjointig_7	6733	446733	440000	
[2026-02-03 23:25:38] DEBUG:  	55	+disjointig_7	446733	452519	5786	
[2026-02-03 23:25:38] DEBUG: *	-68	+disjointig_8	0	289388	289388	
[2026-02-03 23:25:38] DEBUG: *	69	+disjointig_8	289388	513964	224576	
[2026-02-03 23:25:38] DEBUG:  	-45	+disjointig_8	513964	517310	3346	
[2026-02-03 23:25:38] DEBUG:  	-45	+disjointig_9	2516	5853	3337	
[2026-02-03 23:25:38] DEBUG: *	-17	+disjointig_9	5853	560019	554166	
[2026-02-03 23:25:38] DEBUG:  	-55	+disjointig_9	560019	565635	5616	
[2026-02-03 23:25:38] DEBUG: Total edges: 69
[2026-02-03 23:25:38] INFO: Parsing reads
[2026-02-03 23:25:47] DEBUG: Building positional index
[2026-02-03 23:25:47] DEBUG: Total sequence: 809296219 bp
[2026-02-03 23:25:47] DEBUG: Building positional index
[2026-02-03 23:25:47] DEBUG: Total sequence: 5112166 bp
[2026-02-03 23:25:47] INFO: Aligning reads to the graph
[2026-02-03 23:25:48] DEBUG: Mean k-mer frequency: 1.02543
[2026-02-03 23:25:48] DEBUG: Repetitive k-mer frequency: 102
[2026-02-03 23:25:48] DEBUG: Filtered 0 repetitive k-mers (0)
[2026-02-03 23:25:48] DEBUG: Sorting k-mer index
[2026-02-03 23:25:49] DEBUG: Selected k-mers: 4984657
[2026-02-03 23:25:49] DEBUG: K-mer index size: 5111418
[2026-02-03 23:25:49] DEBUG: Mean k-mer frequency: 1.02543
[2026-02-03 23:25:49] DEBUG: Minimizer rate: 1.00015
[2026-02-03 23:26:51] DEBUG: Total reads : 142241
[2026-02-03 23:26:51] DEBUG: Read with aligned parts : 141001
[2026-02-03 23:26:51] DEBUG: Aligned in one piece : 140760
[2026-02-03 23:26:51] INFO: Aligned read sequence: 681199625 / 689064639 (0.988586)
[2026-02-03 23:26:51] INFO: Median overlap divergence: 0.00474757
[2026-02-03 23:26:51] DEBUG: Sequence divergence distribution: 

    |*                                                 |                                                 
    |*                                                 |                                                 
    |*                                                 |                                                 
    |*                                                 |                                                 
    |*                                                 |                                                 
    |*                                                 |                                                 
    |*                                                 |                                                 
    |*                                                 |                                                 
    |*                                                 |                                                 
    |**                                                |                                                 
    |**                                                |                                                 
    |**                                                |                                                 
    |**                                                |                                                 
    |**                                                |                                                 
    |**                                                |                                                 
    |**                                                |                                                 
    |**                                                |                                                 
    |***                                               |                                                 
    |***                                               |                                                 
    |************************************************* | * *                                             
    ----------------------------------------------------------------------------------------------------
    0%        5%        10%       15%       20%       25%       30%       35%       40%       45%       

    Q25 = 0.0035, Q50 = 0.0047, Q75 = 0.0072

[2026-02-03 23:26:52] INFO: Mean edge coverage: 132
[2026-02-03 23:26:52] DEBUG: 6	len:37873	cov:157	mult:1.18939
[2026-02-03 23:26:52] DEBUG: -6	len:37873	cov:157	mult:1.18939
[2026-02-03 23:26:52] DEBUG: 9	len:222141	cov:134	mult:1.01515
[2026-02-03 23:26:52] DEBUG: -9	len:222141	cov:134	mult:1.01515
[2026-02-03 23:26:52] DEBUG: 16	len:21105	cov:132	mult:1
[2026-02-03 23:26:52] DEBUG: -16	len:21105	cov:132	mult:1
[2026-02-03 23:26:52] DEBUG: 17	len:554166	cov:118	mult:0.893939
[2026-02-03 23:26:52] DEBUG: -17	len:554166	cov:118	mult:0.893939
[2026-02-03 23:26:52] DEBUG: 24	len:269327	cov:113	mult:0.856061
[2026-02-03 23:26:52] DEBUG: -24	len:269327	cov:113	mult:0.856061
[2026-02-03 23:26:52] DEBUG: 27	len:2852	cov:105	mult:0.795455
[2026-02-03 23:26:52] DEBUG: -27	len:2852	cov:105	mult:0.795455
[2026-02-03 23:26:52] DEBUG: 28	len:2299	cov:1	mult:0.00757576
[2026-02-03 23:26:52] DEBUG: -28	len:2299	cov:1	mult:0.00757576
[2026-02-03 23:26:52] DEBUG: 36	len:10409	cov:76	mult:0.575758
[2026-02-03 23:26:52] DEBUG: -36	len:10409	cov:76	mult:0.575758
[2026-02-03 23:26:52] DEBUG: 38	len:33374	cov:94	mult:0.712121
[2026-02-03 23:26:52] DEBUG: -38	len:33374	cov:94	mult:0.712121
[2026-02-03 23:26:52] DEBUG: 40	len:6758	cov:69	mult:0.522727
[2026-02-03 23:26:52] DEBUG: -40	len:6758	cov:69	mult:0.522727
[2026-02-03 23:26:52] DEBUG: 45	len:3303	cov:313	mult:2.37121
[2026-02-03 23:26:52] DEBUG: -45	len:3303	cov:313	mult:2.37121
[2026-02-03 23:26:52] DEBUG: 47	len:554897	cov:153	mult:1.15909
[2026-02-03 23:26:52] DEBUG: -47	len:554897	cov:153	mult:1.15909
[2026-02-03 23:26:52] DEBUG: 50	len:490362	cov:107	mult:0.810606
[2026-02-03 23:26:52] DEBUG: -50	len:490362	cov:107	mult:0.810606
[2026-02-03 23:26:52] DEBUG: 52	len:135631	cov:111	mult:0.840909
[2026-02-03 23:26:52] DEBUG: -52	len:135631	cov:111	mult:0.840909
[2026-02-03 23:26:52] DEBUG: 53	len:30123	cov:167	mult:1.26515
[2026-02-03 23:26:52] DEBUG: -53	len:30123	cov:167	mult:1.26515
[2026-02-03 23:26:52] DEBUG: 54	len:119703	cov:156	mult:1.18182
[2026-02-03 23:26:52] DEBUG: -54	len:119703	cov:156	mult:1.18182
[2026-02-03 23:26:52] DEBUG: 55	len:5400	cov:1161	mult:8.79545
[2026-02-03 23:26:52] DEBUG: -55	len:5400	cov:1161	mult:8.79545
[2026-02-03 23:26:52] DEBUG: 56	len:440000	cov:156	mult:1.18182
[2026-02-03 23:26:52] DEBUG: -56	len:440000	cov:156	mult:1.18182
[2026-02-03 23:26:52] DEBUG: 57	len:31311	cov:136	mult:1.0303
[2026-02-03 23:26:52] DEBUG: -57	len:31311	cov:136	mult:1.0303
[2026-02-03 23:26:52] DEBUG: 58	len:87428	cov:171	mult:1.29545
[2026-02-03 23:26:52] DEBUG: -58	len:87428	cov:171	mult:1.29545
[2026-02-03 23:26:52] DEBUG: 59	len:90677	cov:162	mult:1.22727
[2026-02-03 23:26:52] DEBUG: -59	len:90677	cov:162	mult:1.22727
[2026-02-03 23:26:52] DEBUG: 60	len:74796	cov:152	mult:1.15152
[2026-02-03 23:26:52] DEBUG: -60	len:74796	cov:152	mult:1.15152
[2026-02-03 23:26:52] DEBUG: 61	len:44954	cov:142	mult:1.07576
[2026-02-03 23:26:52] DEBUG: -61	len:44954	cov:142	mult:1.07576
[2026-02-03 23:26:52] DEBUG: 62	len:12478	cov:251	mult:1.90152
[2026-02-03 23:26:52] DEBUG: -62	len:12478	cov:251	mult:1.90152
[2026-02-03 23:26:52] DEBUG: 63	len:26663	cov:117	mult:0.886364
[2026-02-03 23:26:52] DEBUG: -63	len:26663	cov:117	mult:0.886364
[2026-02-03 23:26:52] DEBUG: 64	len:280424	cov:108	mult:0.818182
[2026-02-03 23:26:52] DEBUG: -64	len:280424	cov:108	mult:0.818182
[2026-02-03 23:26:52] DEBUG: 65	len:183242	cov:104	mult:0.787879
[2026-02-03 23:26:52] DEBUG: -65	len:183242	cov:104	mult:0.787879
[2026-02-03 23:26:52] DEBUG: 66	len:109059	cov:196	mult:1.48485
[2026-02-03 23:26:52] DEBUG: -66	len:109059	cov:196	mult:1.48485
[2026-02-03 23:26:52] DEBUG: 67	len:653529	cov:142	mult:1.07576
[2026-02-03 23:26:52] DEBUG: -67	len:653529	cov:142	mult:1.07576
[2026-02-03 23:26:52] DEBUG: 68	len:289388	cov:119	mult:0.901515
[2026-02-03 23:26:52] DEBUG: -68	len:289388	cov:119	mult:0.901515
[2026-02-03 23:26:52] DEBUG: 69	len:224576	cov:108	mult:0.818182
[2026-02-03 23:26:52] DEBUG: -69	len:224576	cov:108	mult:0.818182
[2026-02-03 23:26:52] DEBUG: Unique coverage threshold 273
[2026-02-03 23:26:52] INFO: Simplifying the graph
[2026-02-03 23:26:52] DEBUG: Read coverage cutoff: 26
[2026-02-03 23:26:52] DEBUG: [SIMPL] Removed 0 paths with low coverage
[2026-02-03 23:26:52] DEBUG: [SIMPL] Masked 0 heterozygous loops
[2026-02-03 23:26:52] DEBUG: Regular bubble: {64,280424,108} {65,183242,104}
[2026-02-03 23:26:52] DEBUG: 	Internal: {28,2299,1} {27,2852,105}
[2026-02-03 23:26:52] DEBUG: [SIMPL] Masked 1 simple bubbles
[2026-02-03 23:26:52] DEBUG: Finding repeats
[2026-02-03 23:26:52] DEBUG: Read coverage cutoff: 26
[2026-02-03 23:26:52] DEBUG: Low-coverage: 28 1
[2026-02-03 23:26:52] DEBUG: Haplo-edge: 27
[2026-02-03 23:26:52] DEBUG: Haplo-edge: 28
[2026-02-03 23:26:52] DEBUG: High-cov: 45	3303	313
[2026-02-03 23:26:52] DEBUG: High-cov: 55	5400	1161
[2026-02-03 23:26:52] DEBUG: Repeat detection iteration 1
[2026-02-03 23:26:52] DEBUG: Starting 62 aln:537
[2026-02-03 23:26:52] DEBUG: 	    T 50	num:109	flank:3285	span:34
[2026-02-03 23:26:52] DEBUG: 	      -47	num:203	flank:4363	span:5
[2026-02-03 23:26:52] DEBUG: Starting -62 aln:537
[2026-02-03 23:26:52] DEBUG: 	      -60	num:117	flank:4294	span:3
[2026-02-03 23:26:52] DEBUG: 	      24	num:108	flank:3386	span:1
[2026-02-03 23:26:52] DEBUG: Mult: 62	12478	251	 (1,1)
[2026-02-03 23:26:52] DEBUG: Starting 58 aln:283
[2026-02-03 23:26:52] DEBUG: 	      -56	num:87	flank:3514	span:5
[2026-02-03 23:26:52] DEBUG: 	      -24	num:39	flank:2757	span:3
[2026-02-03 23:26:52] DEBUG: Mult: 58	87428	171	 (0,1)
[2026-02-03 23:26:52] DEBUG: Starting -68 aln:223
[2026-02-03 23:26:52] DEBUG: 	      -16	num:104	flank:3117	span:3
[2026-02-03 23:26:52] DEBUG: 	      69	num:119	flank:3357	span:1
[2026-02-03 23:26:52] DEBUG: Mult: 68	289388	119	 (1,0)
[2026-02-03 23:26:52] DEBUG: Starting -67 aln:231
[2026-02-03 23:26:52] DEBUG: 	      -38	num:70	flank:2783	span:3
[2026-02-03 23:26:52] DEBUG: 	    T 40	num:63	flank:3332	span:1
[2026-02-03 23:26:52] DEBUG: Mult: 67	653529	142	 (1,0)
[2026-02-03 23:26:52] DEBUG: Writing Dot
[2026-02-03 23:26:52] DEBUG: Writing FASTA
[2026-02-03 23:26:52] DEBUG: Writing Gfa
[2026-02-03 23:26:52] DEBUG: [SIMPL] == Iteration 1 ==
[2026-02-03 23:26:52] DEBUG: Splitting nodes
[2026-02-03 23:26:52] DEBUG: [SIMPL] Split 0 nodes
[2026-02-03 23:26:52] DEBUG: Tip -36 len:10409 cov:76
[2026-02-03 23:26:52] DEBUG: Tip 40 len:6758 cov:69
[2026-02-03 23:26:52] DEBUG: [SIMPL] Clipped 2 short and 0 long tips
[2026-02-03 23:26:52] DEBUG: [SIMPL] Masked 0 heterozygous loops
[2026-02-03 23:26:52] DEBUG: Regular bubble: {64,280424,108} {65,183242,104}
[2026-02-03 23:26:52] DEBUG: 	Internal: {28,2299,1} {27,2852,105}
[2026-02-03 23:26:52] DEBUG: [SIMPL] Masked 1 simple bubbles
[2026-02-03 23:26:52] DEBUG: Finding repeats
[2026-02-03 23:26:52] DEBUG: Read coverage cutoff: 26
[2026-02-03 23:26:52] DEBUG: Low-coverage: 28 1
[2026-02-03 23:26:52] DEBUG: Haplo-edge: 27
[2026-02-03 23:26:52] DEBUG: Haplo-edge: 28
[2026-02-03 23:26:52] DEBUG: High-cov: 45	3303	313
[2026-02-03 23:26:52] DEBUG: High-cov: 55	5400	1161
[2026-02-03 23:26:52] DEBUG: Repeat detection iteration 1
[2026-02-03 23:26:52] DEBUG: Starting 62 aln:537
[2026-02-03 23:26:52] DEBUG: 	    T 50	num:109	flank:3285	span:34
[2026-02-03 23:26:52] DEBUG: 	      -47	num:203	flank:4363	span:5
[2026-02-03 23:26:52] DEBUG: Starting -62 aln:537
[2026-02-03 23:26:52] DEBUG: 	      -60	num:117	flank:4294	span:3
[2026-02-03 23:26:52] DEBUG: 	      24	num:108	flank:3386	span:1
[2026-02-03 23:26:52] DEBUG: Mult: 62	12478	251	 (1,1)
[2026-02-03 23:26:52] DEBUG: Starting 58 aln:283
[2026-02-03 23:26:52] DEBUG: 	      -56	num:87	flank:3514	span:5
[2026-02-03 23:26:52] DEBUG: 	      -24	num:39	flank:2757	span:3
[2026-02-03 23:26:52] DEBUG: Mult: 58	87428	171	 (0,1)
[2026-02-03 23:26:52] DEBUG: Starting -68 aln:223
[2026-02-03 23:26:52] DEBUG: 	      -16	num:104	flank:3117	span:3
[2026-02-03 23:26:52] DEBUG: 	      69	num:119	flank:3357	span:1
[2026-02-03 23:26:52] DEBUG: Mult: 68	289388	119	 (1,0)
[2026-02-03 23:26:52] DEBUG: Total unique edges: 24
[2026-02-03 23:26:52] DEBUG: 	Connection 54	-6	1	1
[2026-02-03 23:26:52] DEBUG: 	Connection -56	61	6	1
[2026-02-03 23:26:52] DEBUG: 	Connection -59	53	5	1
[2026-02-03 23:26:52] DEBUG: 	Connection 17	-69	12	1
[2026-02-03 23:26:52] DEBUG: 	Connection -6	60	1	1
[2026-02-03 23:26:52] DEBUG: 	Connection 9	47	23	1
[2026-02-03 23:26:52] DEBUG: 	Connection 67	-61	24	1
[2026-02-03 23:26:52] DEBUG: 	Connection -57	16	4	1
[2026-02-03 23:26:52] DEBUG: [SIMPL] Resolved repeats: 8
[2026-02-03 23:26:52] DEBUG: RR links: 152
[2026-02-03 23:26:52] DEBUG: Unresolved: 0
[2026-02-03 23:26:52] DEBUG: Removed 0 simple and 0 double chimeric junctions
[2026-02-03 23:26:52] DEBUG: [SIMPL] == Iteration 2 ==
[2026-02-03 23:26:52] DEBUG: Splitting nodes
[2026-02-03 23:26:52] DEBUG: [SIMPL] Split 0 nodes
[2026-02-03 23:26:52] DEBUG: [SIMPL] Clipped 0 short and 0 long tips
[2026-02-03 23:26:52] DEBUG: [SIMPL] Masked 0 heterozygous loops
[2026-02-03 23:26:52] DEBUG: Regular bubble: {64,280424,108} {65,183242,104}
[2026-02-03 23:26:52] DEBUG: 	Internal: {28,2299,1} {27,2852,105}
[2026-02-03 23:26:52] DEBUG: [SIMPL] Masked 1 simple bubbles
[2026-02-03 23:26:52] DEBUG: Finding repeats
[2026-02-03 23:26:52] DEBUG: Read coverage cutoff: 26
[2026-02-03 23:26:52] DEBUG: Low-coverage: 28 1
[2026-02-03 23:26:52] DEBUG: Haplo-edge: 27
[2026-02-03 23:26:52] DEBUG: Haplo-edge: 28
[2026-02-03 23:26:52] DEBUG: High-cov: 55	5400	1161
[2026-02-03 23:26:52] DEBUG: Repeat detection iteration 1
[2026-02-03 23:26:52] DEBUG: Starting 62 aln:537
[2026-02-03 23:26:52] DEBUG: 	    T 50	num:109	flank:3285	span:34
[2026-02-03 23:26:52] DEBUG: 	      -47	num:203	flank:4363	span:5
[2026-02-03 23:26:52] DEBUG: Starting -62 aln:537
[2026-02-03 23:26:52] DEBUG: 	      -60	num:117	flank:4294	span:3
[2026-02-03 23:26:52] DEBUG: 	      24	num:108	flank:3386	span:1
[2026-02-03 23:26:52] DEBUG: Mult: 62	12478	251	 (1,1)
[2026-02-03 23:26:52] DEBUG: Starting 58 aln:283
[2026-02-03 23:26:52] DEBUG: 	      -56	num:87	flank:3514	span:5
[2026-02-03 23:26:52] DEBUG: 	      -24	num:39	flank:2757	span:3
[2026-02-03 23:26:52] DEBUG: Mult: 58	87428	171	 (0,1)
[2026-02-03 23:26:52] DEBUG: Starting -68 aln:223
[2026-02-03 23:26:52] DEBUG: 	      -16	num:104	flank:3117	span:3
[2026-02-03 23:26:52] DEBUG: 	      69	num:119	flank:3357	span:1
[2026-02-03 23:26:52] DEBUG: Mult: 68	289388	119	 (1,0)
[2026-02-03 23:26:52] DEBUG: Total unique edges: 32
[2026-02-03 23:26:52] DEBUG: [SIMPL] Resolved repeats: 0
[2026-02-03 23:26:52] DEBUG: RR links: 0
[2026-02-03 23:26:52] DEBUG: Unresolved: 0
[2026-02-03 23:26:52] DEBUG: Removed 0 simple and 0 double chimeric junctions
[2026-02-03 23:26:52] DEBUG: [SIMPL] Collapsed 1 haplotypes
[2026-02-03 23:26:52] DEBUG: 	Connection -58	-59	4
[2026-02-03 23:26:52] DEBUG: [SIMPL] Resolved 1 simple repeats
[2026-02-03 23:26:52] DEBUG: Read coverage cutoff: 26
[2026-02-03 23:26:52] DEBUG: [SIMPL] Removed 0 paths with low coverage
[2026-02-03 23:26:52] DEBUG: Finding repeats
[2026-02-03 23:26:52] DEBUG: Read coverage cutoff: 26
[2026-02-03 23:26:52] DEBUG: Low-coverage: 28 1
[2026-02-03 23:26:52] DEBUG: Haplo-edge: 27
[2026-02-03 23:26:52] DEBUG: Haplo-edge: 28
[2026-02-03 23:26:52] DEBUG: Repeat detection iteration 1
[2026-02-03 23:26:52] DEBUG: Starting 62 aln:537
[2026-02-03 23:26:52] DEBUG: 	    T 50	num:109	flank:3285	span:34
[2026-02-03 23:26:52] DEBUG: 	      -47	num:203	flank:4363	span:5
[2026-02-03 23:26:52] DEBUG: Starting -62 aln:537
[2026-02-03 23:26:52] DEBUG: 	      -60	num:117	flank:4294	span:3
[2026-02-03 23:26:52] DEBUG: 	      24	num:108	flank:3386	span:1
[2026-02-03 23:26:52] DEBUG: Mult: 62	12478	251	 (1,1)
[2026-02-03 23:26:52] DEBUG: Starting -68 aln:223
[2026-02-03 23:26:52] DEBUG: 	      -16	num:104	flank:3117	span:3
[2026-02-03 23:26:52] DEBUG: 	      69	num:119	flank:3357	span:1
[2026-02-03 23:26:52] DEBUG: Mult: 68	289388	119	 (1,0)
[2026-02-03 23:26:52] DEBUG: Starting 58 aln:126
[2026-02-03 23:26:52] DEBUG: 	      -56	num:87	flank:3514	span:5
[2026-02-03 23:26:52] DEBUG: 	      -24	num:39	flank:2757	span:3
[2026-02-03 23:26:52] DEBUG: Mult: -60 -> 74 -> 6 -> -70 -> -54 -> -53 -> 72 -> 59 -> -79 -> 58	462244	160	 (0,1)
[2026-02-03 23:26:52] DEBUG: Fixed: -60 -> 74 -> 6 -> -70 -> -54 -> -53 -> 72 -> 59 -> -79 -> 58	462244	160
[2026-02-03 23:26:52] DEBUG: Fixed: 68	289388	119
[2026-02-03 23:26:52] DEBUG: Writing Dot
[2026-02-03 23:26:52] DEBUG: Writing FASTA
[2026-02-03 23:26:52] DEBUG: Peak RAM usage: 0 Gb
-----------End assembly log------------
[2026-02-03 23:26:52] root: INFO: >>>STAGE: contigger
[2026-02-03 23:26:52] root: INFO: Generating contigs
[2026-02-03 23:26:52] root: DEBUG: -----Begin contigger analyser log------
[2026-02-03 23:26:52] root: DEBUG: Running: flye-modules contigger --graph-edges /home/matda/Assignment1Data/flye_out/20-repeat/repeat_graph_edges.fasta --reads /home/matda/Assignment1Data/SRR32410565.fastq.gz --out-dir /home/matda/Assignment1Data/flye_out/30-contigger --config /home/matda/miniconda3/envs/flye/lib/python3.12/site-packages/flye/config/bin_cfg/asm_raw_reads.cfg --repeat-graph /home/matda/Assignment1Data/flye_out/20-repeat/repeat_graph_dump --graph-aln /home/matda/Assignment1Data/flye_out/20-repeat/read_alignment_dump --log /home/matda/Assignment1Data/flye_out/flye.log --threads 8 --min-ovlp 3000
[2026-02-03 23:26:52] DEBUG: Build date: May  4 2025 23:18:25
[2026-02-03 23:26:52] DEBUG: Total RAM: 15 Gb
[2026-02-03 23:26:52] DEBUG: Available RAM: 15 Gb
[2026-02-03 23:26:52] DEBUG: Total CPUs: 16
[2026-02-03 23:26:52] DEBUG: Loading /home/matda/miniconda3/envs/flye/lib/python3.12/site-packages/flye/config/bin_cfg/asm_raw_reads.cfg
[2026-02-03 23:26:52] DEBUG: Loading /home/matda/miniconda3/envs/flye/lib/python3.12/site-packages/flye/config/bin_cfg/asm_defaults.cfg
[2026-02-03 23:26:52] DEBUG: 	big_genome_threshold=29000000
[2026-02-03 23:26:52] DEBUG: 	meta_read_filter_kmer_freq=100
[2026-02-03 23:26:52] DEBUG: 	chain_large_gap_penalty=2
[2026-02-03 23:26:52] DEBUG: 	chain_small_gap_penalty=0.5
[2026-02-03 23:26:52] DEBUG: 	chain_gap_jump_threshold=100
[2026-02-03 23:26:52] DEBUG: 	max_jump_gap=500
[2026-02-03 23:26:52] DEBUG: 	max_coverage_drop_rate=5
[2026-02-03 23:26:52] DEBUG: 	max_extensions_drop_rate=5
[2026-02-03 23:26:52] DEBUG: 	chimera_window=100
[2026-02-03 23:26:52] DEBUG: 	chimera_overhang=1000
[2026-02-03 23:26:52] DEBUG: 	min_reads_in_disjointig=4
[2026-02-03 23:26:52] DEBUG: 	max_inner_reads=10
[2026-02-03 23:26:52] DEBUG: 	max_inner_fraction=0.25
[2026-02-03 23:26:52] DEBUG: 	aggressive_dup_filter=1
[2026-02-03 23:26:52] DEBUG: 	max_separation=500
[2026-02-03 23:26:52] DEBUG: 	unique_edge_length=50000
[2026-02-03 23:26:52] DEBUG: 	min_repeat_res_support=0.51
[2026-02-03 23:26:52] DEBUG: 	out_paths_ratio=5
[2026-02-03 23:26:52] DEBUG: 	graph_cov_drop_rate=5
[2026-02-03 23:26:52] DEBUG: 	coverage_estimate_window=100
[2026-02-03 23:26:52] DEBUG: 	max_bubble_length=50000
[2026-02-03 23:26:52] DEBUG: 	loop_coverage_rate=1.5
[2026-02-03 23:26:52] DEBUG: 	repeat_edge_cov_mult=1.75
[2026-02-03 23:26:52] DEBUG: 	weak_detach_rate=5
[2026-02-03 23:26:52] DEBUG: 	tip_coverage_rate=2
[2026-02-03 23:26:52] DEBUG: 	tip_length_rate=2
[2026-02-03 23:26:52] DEBUG: 	output_gfa_before_rr=1
[2026-02-03 23:26:52] DEBUG: 	remove_alt_edges=0
[2026-02-03 23:26:52] DEBUG: 	low_cutoff_warning=1
[2026-02-03 23:26:52] DEBUG: 	kmer_size=17
[2026-02-03 23:26:52] DEBUG: 	use_minimizers=0
[2026-02-03 23:26:52] DEBUG: 	reads_base_alignment=0
[2026-02-03 23:26:52] DEBUG: 	meta_read_top_kmer_rate=0.40
[2026-02-03 23:26:52] DEBUG: 	maximum_jump=1500
[2026-02-03 23:26:52] DEBUG: 	maximum_overhang=1500
[2026-02-03 23:26:52] DEBUG: 	repeat_kmer_rate=100
[2026-02-03 23:26:52] DEBUG: 	assemble_ovlp_divergence=0.10
[2026-02-03 23:26:52] DEBUG: 	assemble_divergence_relative=1
[2026-02-03 23:26:52] DEBUG: 	repeat_graph_ovlp_divergence=0.08
[2026-02-03 23:26:52] DEBUG: 	read_align_ovlp_divergence=0.25
[2026-02-03 23:26:52] DEBUG: 	hpc_scoring_on=0
[2026-02-03 23:26:52] DEBUG: 	add_unassembled_reads=0
[2026-02-03 23:26:52] DEBUG: 	extend_contigs_with_repeats=0
[2026-02-03 23:26:52] DEBUG: 	min_read_cov_cutoff=3
[2026-02-03 23:26:52] DEBUG: 	short_tip_length=20000
[2026-02-03 23:26:52] DEBUG: 	long_tip_length=100000
[2026-02-03 23:26:52] DEBUG: Running with k-mer size: 17
[2026-02-03 23:26:52] DEBUG: Selected minimum overlap 3000
[2026-02-03 23:26:52] INFO: Reading sequences
[2026-02-03 23:27:00] DEBUG: Building positional index
[2026-02-03 23:27:00] DEBUG: Total sequence: 809296219 bp
[2026-02-03 23:27:01] DEBUG: Flipped 0
[2026-02-03 23:27:01] DEBUG: UPath 1: -60 -> 74 -> 6 -> -70 -> -54 -> -53 -> 72 -> 59 -> -79 -> 58
[2026-02-03 23:27:01] DEBUG: UPath 2: 69 -> 73 -> -17 -> -55 -> 9 -> 75 -> 47
[2026-02-03 23:27:01] DEBUG: UPath 3: -56 -> 71 -> 61 -> -76 -> -67 -> -38 -> -57 -> -77 -> 16
[2026-02-03 23:27:01] DEBUG: UPath 4: 24
[2026-02-03 23:27:01] DEBUG: UPath 5: 27
[2026-02-03 23:27:01] DEBUG: UPath 6: 28
[2026-02-03 23:27:01] DEBUG: UPath 7: 36
[2026-02-03 23:27:01] DEBUG: UPath 8: 40
[2026-02-03 23:27:01] DEBUG: UPath 9: 50
[2026-02-03 23:27:01] DEBUG: UPath 10: 52
[2026-02-03 23:27:01] DEBUG: UPath 11: 62
[2026-02-03 23:27:01] DEBUG: UPath 12: 63 -> 64 -> 78 -> 65
[2026-02-03 23:27:01] DEBUG: UPath 13: 66
[2026-02-03 23:27:01] DEBUG: UPath 14: 68
[2026-02-03 23:27:01] DEBUG: Final graph contains 14 egdes
[2026-02-03 23:27:01] DEBUG: Extending contigs into repeats
[2026-02-03 23:27:01] DEBUG: Covered 0 repetitive contigs
[2026-02-03 23:27:01] INFO: Generated 14 contigs
[2026-02-03 23:27:01] DEBUG: Writing FASTA
[2026-02-03 23:27:01] DEBUG: Generating scaffold connections
[2026-02-03 23:27:01] INFO: Added 0 scaffold connections
[2026-02-03 23:27:01] DEBUG: Writing Dot
[2026-02-03 23:27:01] DEBUG: Writing FASTA
[2026-02-03 23:27:01] DEBUG: Writing Gfa
[2026-02-03 23:27:01] DEBUG: Peak RAM usage: 0 Gb
-----------End assembly log------------
[2026-02-03 23:27:01] root: INFO: >>>STAGE: polishing
[2026-02-03 23:27:01] root: INFO: Polishing genome (1/1)
[2026-02-03 23:27:01] root: INFO: Running minimap2
[2026-02-03 23:28:00] root: INFO: Separating alignment into bubbles
[2026-02-03 23:30:05] root: DEBUG: Generated 353044 bubbles
[2026-02-03 23:30:05] root: DEBUG: Split 3 long bubbles
[2026-02-03 23:30:05] root: DEBUG: Skipped 0 empty bubbles
[2026-02-03 23:30:05] root: DEBUG: Skipped 1 bubbles with long branches
[2026-02-03 23:30:05] root: INFO: Alignment error rate: 0.017972
[2026-02-03 23:30:05] root: INFO: Correcting bubbles
[2026-02-03 23:30:36] root: DEBUG: Mean contig coverage: 160, selected threshold: 32
[2026-02-03 23:30:36] root: DEBUG: Filtered 2 contigs of total length 13261
[2026-02-03 23:30:36] root: DEBUG: Generating polished GFA
[2026-02-03 23:30:37] root: DEBUG: 0 sequences remained unpolished
[2026-02-03 23:30:37] root: INFO: >>>STAGE: finalize
[2026-02-03 23:30:37] root: DEBUG: ---Output dir contents:----
[2026-02-03 23:30:37] root: DEBUG: flye_out/
[2026-02-03 23:30:37] root: DEBUG:     2.0 K       assembly_graph.gv
[2026-02-03 23:30:37] root: DEBUG:     56.0 K      flye.log
[2026-02-03 23:30:37] root: DEBUG:     4.0 M       assembly.fasta
[2026-02-03 23:30:37] root: DEBUG:     95.0 B      params.json
[2026-02-03 23:30:37] root: DEBUG:     4.0 M       assembly_graph.gfa
[2026-02-03 23:30:37] root: DEBUG:     40-polishing/
[2026-02-03 23:30:37] root: DEBUG:         1.0 M       base_coverage.bed.gz
[2026-02-03 23:30:37] root: DEBUG:         881.0 B     minimap.stderr
[2026-02-03 23:30:37] root: DEBUG:         4.0 M       polished_edges.gfa
[2026-02-03 23:30:37] root: DEBUG:         326.0 B     filtered_contigs.fasta.fai
[2026-02-03 23:30:37] root: DEBUG:         289.0 B     edges_aln.bam.csi
[2026-02-03 23:30:37] root: DEBUG:         249.0 B     filtered_stats.txt
[2026-02-03 23:30:37] root: DEBUG:         55.0 K      minimap_1.bam.csi
[2026-02-03 23:30:37] root: DEBUG:         4.0 M       filtered_contigs.fasta
[2026-02-03 23:30:37] root: DEBUG:         284.0 B     contigs_stats.txt
[2026-02-03 23:30:37] root: DEBUG:     30-contigger/
[2026-02-03 23:30:37] root: DEBUG:         413.0 B     contigs.fasta.fai
[2026-02-03 23:30:37] root: DEBUG:         0.0 B       scaffolds_links.txt
[2026-02-03 23:30:37] root: DEBUG:         4.0 M       graph_final.gfa
[2026-02-03 23:30:37] root: DEBUG:         2.0 K       graph_final.gv
[2026-02-03 23:30:37] root: DEBUG:         4.0 M       contigs.fasta
[2026-02-03 23:30:37] root: DEBUG:         584.0 B     contigs_stats.txt
[2026-02-03 23:30:37] root: DEBUG:         4.0 M       graph_final.fasta
[2026-02-03 23:30:37] root: DEBUG:     00-assembly/
[2026-02-03 23:30:37] root: DEBUG:         577.0 B     draft_assembly.fasta.fai
[2026-02-03 23:30:37] root: DEBUG:         5.0 M       draft_assembly.fasta
[2026-02-03 23:30:37] root: DEBUG:     10-consensus/
[2026-02-03 23:30:37] root: DEBUG:         930.0 B     minimap.stderr
[2026-02-03 23:30:37] root: DEBUG:         56.0 K      minimap.bam.csi
[2026-02-03 23:30:37] root: DEBUG:         5.0 M       consensus.fasta
[2026-02-03 23:30:37] root: DEBUG:     20-repeat/
[2026-02-03 23:30:37] root: DEBUG:         34.0 M      read_alignment_dump
[2026-02-03 23:30:37] root: DEBUG:         4.0 M       repeat_graph_edges.fasta
[2026-02-03 23:30:37] root: DEBUG:         4.0 K       graph_before_rr.gv
[2026-02-03 23:30:37] root: DEBUG:         9.0 K       repeat_graph_dump
[2026-02-03 23:30:37] root: DEBUG:         5.0 K       graph_after_rr.gv
[2026-02-03 23:30:37] root: DEBUG:         4.0 M       graph_before_rr.fasta
[2026-02-03 23:30:37] root: DEBUG:         4.0 M       graph_before_rr.gfa
[2026-02-03 23:30:37] root: DEBUG: --------------------------
[2026-02-03 23:30:37] root: INFO: Assembly statistics:

	Total length:	5102793
	Fragments:	11
	Fragments N50:	1238287
	Largest frg:	1575391
	Scaffolds:	0
	Mean coverage:	161

[2026-02-03 23:30:37] root: INFO: Final assembly: /home/matda/Assignment1Data/flye_out/assembly.fasta
